{
  "$schema": "https://borzilleri.net/taplist-data/schema/dataset.schema.json",
  "id": "wbf-2026",
  "festival": "Washington Brewers Festival 2026",
  "updatedAt": "2026-06-09T00:00:00Z",
  "beers": [
    {
      "id": "wbf26-0001",
      "name": "Los Vientos",
      "brewery": "210 Brewing Co.",
      "abv": 5.1,
      "style": "Mexican Lager",
      "styleCategory": "Lager & Pilsner"
    },
    {
      "id": "wbf26-0002",
      "name": "Pineapple Heff Wheatley",
      "brewery": "210 Brewing Co.",
      "abv": 5,
      "style": "Pineapple Hefeweizen",
      "styleCategory": "Wheat"
    },
    {
      "id": "wbf26-0003",
      "name": "PEAK IPA",
      "brewery": "210 Brewing Co.",
      "abv": 7.2,
      "style": "Hazy IPA",
      "styleCategory": "IPA",
      "description": "Brewed with Nelson Cryo, Loral Cryo, Dolcita, Sultana!"
    },
    {
      "id": "wbf26-0004",
      "name": "Emotional Support Space Horse",
      "brewery": "210 Brewing Co.",
      "abv": 7,
      "style": "Hazy IPA",
      "styleCategory": "IPA",
      "description": "Brewed with Azacca, Citra, Galaxy!"
    },
    {
      "id": "wbf26-0005",
      "name": "Drop Bear Hazy Pale",
      "brewery": "7 Seas Brewing Co",
      "abv": 5.5,
      "style": "Down Under Hazy Pale",
      "styleCategory": "Pale Ale",
      "description": "Golden and hazy with a juicy abundance of Southern Hemisphere grown hops, Motueka, Nectaron, Galaxy, Nelson Sauvin. Big aroma notes of bright lemon zest, white peach, and tropical intensity."
    },
    {
      "id": "wbf26-0006",
      "name": "Nomadic IPA",
      "brewery": "7 Seas Brewing Co",
      "abv": 6.7,
      "style": "West Coast IPA",
      "styleCategory": "IPA",
      "description": "Decidedly West Coast Style, Nomadic IPA displays a bright, deep golden color with a subtle yet toasty, semi-dry malt flavor. Assertive hop character of citrus peel, resin, and tangerine shine through from start to finish."
    },
    {
      "id": "wbf26-0007",
      "name": "Velvet Tang",
      "brewery": "7 Seas Brewing Co",
      "abv": 7,
      "style": "Hazy IPA",
      "styleCategory": "IPA",
      "description": "Soft & Supple on the pallet, Velvet Tang delivers a walloping hop aroma of juicy, tropical excellence with a smooth finish. Brewed with NW pale and 2-row malts, along with flaked wheat and oats. Hops include Simcoe, Citra, Mosaic, and hefty dry hop additions of Azacca and Citra."
    },
    {
      "id": "wbf26-0008",
      "name": "Red Raspberry Sour Ale",
      "brewery": "7 Seas Brewing Co",
      "abv": 4.7,
      "style": "Gose Style Sour Ale",
      "styleCategory": "Sour & Gose",
      "description": "Our Gose-Style Red Raspberry Sour Ale is JAM-PACKED with Ripe Red Raspberries,\nperfectly balanced with local San Juan Island Sea salt. This tart and ever-so-slightly herbaceous beer is bright and delightfully refreshing, making it the ideal brew for heading into Spring."
    },
    {
      "id": "wbf26-0009",
      "name": "Heidelberg",
      "brewery": "7 Seas Brewing Co",
      "abv": 4,
      "description": "Brewed on a base of NW pilsner malt along with flaked corn and rice. Hopped with Yakima Magnum and German Hallertau, yielding a perfectly crisp, refreshing and easy-going beer.",
      "styleCategory": "Lager & Pilsner"
    },
    {
      "id": "wbf26-0010",
      "name": "Triple Vision",
      "brewery": "anacortes brewery",
      "abv": 9.8,
      "style": "Belgian Tripel",
      "styleCategory": "Belgian & Strong",
      "description": "Belgian Tripel\nAdheres to traditional guidelines with it's pale straw color\nfrom pilsner malt and it's high alcohol content. This spicy Belgian will\nmake your lips sing!\nOG 1.095 / ABV 9.8% / IBU 25"
    },
    {
      "id": "wbf26-0011",
      "name": "Cream Bee",
      "brewery": "anacortes brewery",
      "abv": 5.5,
      "style": "Honey Cream Ale",
      "styleCategory": "Blonde, Kölsch & Cream",
      "description": "Cream Bee\nBrewed with local honey, this smooth cream ale is lagered for crispness and\nfeatures subtle hop aroma and balanced bitterness from Hallertau and Spalter hops.\nOG 1.051 / ABV 5.5% / IBU 35"
    },
    {
      "id": "wbf26-0012",
      "name": "Tide Breaker",
      "brewery": "Aslan Brewing Co.",
      "abv": 6.2,
      "style": "West Coast IPA",
      "styleCategory": "IPA",
      "description": "A modern West Coast IPA with notes of bright citrus, juicy mango, and a hint of pine."
    },
    {
      "id": "wbf26-0013",
      "name": "Dawn Patrol",
      "brewery": "Aslan Brewing Co.",
      "style": "Pale Ale",
      "styleCategory": "Pale Ale",
      "description": "An easy drinking modern pale ale with notes of orange, mango, and melon"
    },
    {
      "id": "wbf26-0014",
      "name": "Mango Tropical IPA",
      "brewery": "Bale Breaker",
      "abv": 5.9,
      "style": "Mango IPA",
      "styleCategory": "IPA",
      "description": "Made with real mango, this Tropical IPA has low bitterness and smells like freshly sliced mango with hints of mandarin orange. A portion of the proceeds from this beer is donated to local nonprofits who support migrant farm workers."
    },
    {
      "id": "wbf26-0015",
      "name": "Arcus Angel IPA",
      "brewery": "Bale Breaker",
      "abv": 6.7,
      "style": "West Coast IPA",
      "styleCategory": "IPA",
      "description": "Arcus Angel IPA—a heavenly arc of hops from first sip to finish. Brewed with 2-Row, Pilsner, and Carapils, it delivers a light body that still carries its weight like a guardian with grit. Mosaic, Chinook, Simcoe, and Strata lift aromas of blueberry, grapefruit, and pine into the upper atmosphere. Bright, resinous, and balanced, this American IPA walks the line between bold and graceful."
    },
    {
      "id": "wbf26-0016",
      "name": "Plethora of Piñats",
      "brewery": "Barley POP! Brewing",
      "abv": 4.5,
      "style": "Mexican Lager",
      "styleCategory": "Lager & Pilsner",
      "description": "Our official Snohomish Pride beer for 2026! This lager is bright, crispy with some sweetness thanks to the flaked corn. Just add your own lime to top it off!"
    },
    {
      "id": "wbf26-0017",
      "name": "The Pen Is Blue",
      "brewery": "Barley POP! Brewing",
      "abv": 6,
      "style": "Hard Seltzer",
      "styleCategory": "Other",
      "description": "The Pen Is Rrrroyal Blue, or in this case pink thanks to our house made raspberry rhubarb concentrate. It's bright, mildly sweet with a tart finish. Nothing artificial about our seltzers, and that's no lie."
    },
    {
      "id": "wbf26-0018",
      "name": "High Quality Hop2o",
      "brewery": "Barley POP! Brewing",
      "abv": 0,
      "style": "NA Hop Water",
      "styleCategory": "NA",
      "description": "Our very refreshing house made hop water is sure to keep you hydrated through the summer heat and in between a brewski or twoski.\nThis batch is flavored with all natural hop extracts featuring Pineapple and Krush hops!\nNo alcohol, no sugar, no carbs, no bullshit!"
    },
    {
      "id": "wbf26-0019",
      "name": "Cats Blue Ribbon",
      "brewery": "Beach Cat Brewing",
      "abv": 5,
      "style": "American Lager",
      "styleCategory": "Lager & Pilsner",
      "description": "Crushable classic American lager. Enjoyable during any season!"
    },
    {
      "id": "wbf26-0020",
      "name": "White Paw Hard Seltzer",
      "brewery": "Beach Cat Brewing",
      "abv": 6,
      "style": "Hard Seltzer",
      "styleCategory": "Other",
      "description": "Refreshing real fruit flavors!"
    },
    {
      "id": "wbf26-0021",
      "name": "La Claw",
      "brewery": "Beach Cat Brewing",
      "abv": 0,
      "style": "Hop Water",
      "styleCategory": "NA",
      "description": "Refreshing n/an option for all!"
    },
    {
      "id": "wbf26-0022",
      "name": "Rainier Cherry",
      "brewery": "Bellingham Cider Co.",
      "abv": 6.7,
      "style": "Hard Cider",
      "styleCategory": "Cider",
      "description": "A fruit-forward semi-dry cider blended with tart and refreshing Rainier and Bing cherries for one of our most approachable and popular ciders."
    },
    {
      "id": "wbf26-0023",
      "name": "Raspberry Lemonade",
      "brewery": "Bellingham Cider Co.",
      "abv": 6.7,
      "style": "Hard Cider",
      "styleCategory": "Cider",
      "description": "Showcasing summer raspberries at their finest, but with a kick. Pleasantly tart lemon paired with strong raspberry notes. Refreshing and rejuvenating. Perfect for summer sipping."
    },
    {
      "id": "wbf26-0024",
      "name": "Death Rides a Horse",
      "brewery": "Bizarre Brewing",
      "abv": 5,
      "style": "Italian-Style Pilsner",
      "styleCategory": "Lager & Pilsner",
      "description": "Death Rides a Horse is our Italian-style pilsner brewed with a blend of German and Italian pilsner malts and hopped in the kettle with Spalt Select, Strisselspalt, Tettnang and Hersbrucker. Death Rides a Horse was fermented cold with our house lager strain then dry hopped with Spalt Select and Perle. Spunded for natural carbonation."
    },
    {
      "id": "wbf26-0025",
      "name": "Crushed in Velvet",
      "brewery": "Bizarre Brewing",
      "abv": 5.6,
      "style": "Soft Pale Ale",
      "styleCategory": "Pale Ale",
      "description": "Crushed in Velvet is our rotating hop soft pale ale that was brewed with pilsner malt and flaked oats. We hopped this batch of soft pale ale in the kettle with Strata, Citra, Simcoe and Chinook. Crushed in Velvet was fermented cool with our house lager strain then dry hopped with Dolcita LupoMax, Galaxy and Strata."
    },
    {
      "id": "wbf26-0026",
      "name": "Brett Bier with Lemon Peel & Coriander",
      "brewery": "Bizarre Brewing",
      "abv": 5,